<?xml version="1.0" encoding="UTF-8"?>
<!DOCTYPE alumnos SYSTEM "Ejercicio34.dtd" >
<alumnos>
  <alumno num_alumno="A1" altura="180" sexo="hombre" ayudante="A2">
    <nombre>Juan</nombre>
    <apellidos>Pérez</apellidos>
    <domicilio>Calle Falsa 123</domicilio>
    <telefono tipo="propio">555-555-555</telefono>
    <equipo_deportivo>Equipo de Futbol</equipo_deportivo>
    <aficion>Leer</aficion>
    <aficion>Viajar</aficion>
    <provincia>Madrid</provincia>
    <comentario>Este alumno es muy responsable</comentario>
    <notas>
      <evaluacion>Examen de Matemáticas</evaluacion>
      <calificacion>8</calificacion>
    </notas>
  </alumno>
  <alumno num_alumno="A2">
    <nombre>Maria</nombre>
    <apellidos>Garcia</apellidos>
    <domicilio>Calle Falsa 124</domicilio>
    <telefono tipo="padre">555-555-556</telefono>
    <origen>Inglaterra</origen>
    <comentario>Esta alumna es muy tímida</comentario>
    <notas>
      <evaluacion>Examen de Literatura</evaluacion>
      <calificacion>10</calificacion>
    </notas>
  </alumno>
</alumnos>